{
  "format": "boris-documentation-intelligence",
  "schemaVersion": "0.2.0",
  "compiler": "boris/0.9.0",
  "input": "docs/contracts/fixtures/documentation-intelligence/content",
  "summary": {
    "pages": 5,
    "roots": 2,
    "satellites": 3,
    "sourceEndpoints": 2,
    "edgeCounts": {
      "incoming": {
        "pages": {"parent": 3, "include": 0, "reference": 3},
        "sources": {"parent": 0, "include": 3, "reference": 0}
      },
      "outgoing": {
        "pages": {"parent": 3, "include": 3, "reference": 2},
        "sources": {"parent": 0, "include": 0, "reference": 1}
      }
    },
    "unreferencedPages": 1,
    "hotspots": 0
  },
  "nodes": [{"type":"page","id":"guides","sourcePath":"guides.md","parent":null},{"type":"page","id":"guides/exit-codes","sourcePath":"guides/exit-codes.md","parent":"guides"},{"type":"page","id":"guides/reference","sourcePath":"guides/reference.md","parent":"guides"},{"type":"page","id":"guides/start","sourcePath":"guides/start.md","parent":"guides"},{"type":"page","id":"index","sourcePath":"index.md","parent":null}],
  "edges": [{"from":{"type":"page","value":"guides"},"to":{"type":"page","value":"guides/start"},"kind":"reference"},{"from":{"type":"page","value":"guides/exit-codes"},"to":{"type":"page","value":"guides"},"kind":"parent"},{"from":{"type":"page","value":"guides/reference"},"to":{"type":"page","value":"guides"},"kind":"parent"},{"from":{"type":"page","value":"guides/reference"},"to":{"type":"source","value":"guides/exit-codes.md"},"kind":"include"},{"from":{"type":"page","value":"guides/reference"},"to":{"type":"source","value":"includes/shared.md"},"kind":"include"},{"from":{"type":"page","value":"guides/start"},"to":{"type":"page","value":"guides"},"kind":"parent"},{"from":{"type":"page","value":"guides/start"},"to":{"type":"source","value":"includes/shared.md"},"kind":"include"},{"from":{"type":"page","value":"index"},"to":{"type":"page","value":"guides"},"kind":"reference"},{"from":{"type":"source","value":"includes/shared.md"},"to":{"type":"page","value":"guides/reference"},"kind":"reference"}],
  "sourceLocations": [{"type":"page","value":"guides","sourcePath":"guides.md","line":1,"column":1},{"type":"page","value":"guides/exit-codes","sourcePath":"guides/exit-codes.md","line":1,"column":1},{"type":"page","value":"guides/reference","sourcePath":"guides/reference.md","line":1,"column":1},{"type":"page","value":"guides/start","sourcePath":"guides/start.md","line":1,"column":1},{"type":"page","value":"index","sourcePath":"index.md","line":1,"column":1}],
  "pages": [{"id":"guides","parent":null},{"id":"guides/exit-codes","parent":"guides"},{"id":"guides/reference","parent":"guides"},{"id":"guides/start","parent":"guides"},{"id":"index","parent":null}],
  "sources": ["guides/exit-codes.md","includes/shared.md"],
  "findings": [{"code":"unreferenced_page","type":"page","value":"index","count":0,"sourcePath":"index.md","line":1,"column":1}],
  "impact": [{"type":"page","value":"guides"},{"type":"page","value":"guides/exit-codes"},{"type":"page","value":"guides/reference"},{"type":"page","value":"guides/start"},{"type":"page","value":"index"}],
  "diagnostics": []
}
